{
  "version": "0.1.0",
  "generated_at": "2026-06-18T01:10:36.997553+00:00",
  "root": "C:\\.01_CAT",
  "status": "pass",
  "checks": [
    {
      "name": "state_alignment",
      "status": "pass",
      "ok": [
        "active_mission_id empty in tower and registry",
        "no active BEAD (bead_id empty)"
      ],
      "issues": [],
      "drift": []
    },
    {
      "name": "branch_root_hygiene",
      "status": "pass",
      "ok": [
        "branch is hygienic: mp-cat-007-log-intelligence",
        "root entries satisfy hygiene allowlist"
      ],
      "issues": []
    }
  ]
}